{
  "$schema": "./tooling/schemas/worlds.schema.json",
  "name": "Horang Universe",
  "site": "https://zaehorang.github.io/horang-universe/",
  "regions": [
    {
      "id": "network",
      "name": "네트워크 해안",
      "pos": [
        300,
        420
      ],
      "tone": "#a9d6a0",
      "hint": "이름이 주소가 되고, 편지가 봉투를 겹겹이 쓰고 벗기는 곳",
      "toneDeep": "#8dbd6f",
      "texture": "dots"
    },
    {
      "id": "ops",
      "name": "운영 항만",
      "pos": [
        800,
        300
      ],
      "tone": "#7cc6d8",
      "hint": "컨테이너를 싣고 내리고, 문을 지키고, 자리를 정하는 곳",
      "toneDeep": "#5eb3c9",
      "texture": "waves"
    },
    {
      "id": "data",
      "name": "데이터 구역",
      "pos": [
        1250,
        480
      ],
      "tone": "#e3e8df",
      "hint": "기록을 찾고 고치고 지키는 곳",
      "toneDeep": "#cdd3c8",
      "texture": "paper"
    }
  ],
  "hub": {
    "id": "hub",
    "status": "verified",
    "sea": "#5fb0c8",
    "seaDeep": "#3f8fab",
    "shore": "#efe2c0"
  },
  "worlds": [
    {
      "id": "db-library",
      "region": "data",
      "pos": [
        1250,
        470
      ],
      "status": "verified"
    },
    {
      "id": "network-layers",
      "region": "network",
      "pos": [
        300,
        465
      ],
      "status": "verified"
    },
    {
      "id": "k8s-harbor",
      "region": "ops",
      "pos": [
        780,
        340
      ],
      "status": "verified"
    },
    {
      "id": "eks-security",
      "region": "ops",
      "pos": [
        900,
        300
      ],
      "status": "verified"
    },
    {
      "id": "http-https",
      "region": "network",
      "pos": [
        410,
        425
      ],
      "status": "verified"
    },
    {
      "id": "k8s-cluster-architecture",
      "region": "ops",
      "status": "archived",
      "redirect": "k8s-harbor"
    }
  ]
}
